title,price,rating,availability
the new drawing on the right side of the brain,43.02,3,in stock
the midnight assassin panic scandal and the hunt for americas first serial killer,28.45,4,in stock
the martian the martian 1,41.39,2,in stock
the high mountains of portugal,51.15,1,in stock
the grownup,35.88,1,in stock
the emyth revisited why most small businesses dont work and what to do about it,36.91,1,in stock
south of sunshine,28.93,1,in stock
smarter faster better the secrets of being productive in life and business,38.89,5,in stock
silence in the dark logan point 4,58.33,3,in stock
shadows of the past logan point 1,39.67,5,in stock
roller girl,14.1,5,in stock
rising strong,21.82,3,in stock
proofs of god classical arguments from tertullian to barth,54.21,1,in stock
please kill me the uncensored oral history of punk,31.19,4,in stock
out of print city lights spotlight no 14,53.64,5,in stock
my life next door my life next door,36.39,5,in stock
millers valley,58.54,2,in stock
mans search for meaning,29.48,3,in stock
love that boy what two presidents eight road trips and my son taught me about a parents expectations,25.06,2,in stock
living forward a proven plan to stop drifting and get the life you want,12.55,3,in stock
les fleurs du mal,29.04,5,in stock
left behind left behind 1,40.72,2,in stock
kill em and leave searching for james brown and the american soul,45.05,5,in stock
kierkegaard a christian missionary to christians,47.13,1,in stock
john vassos industrial design for modern life,20.22,4,in stock
ill give you the sun,56.48,1,in stock
i will find you,44.21,1,in stock
hystopia a novel,21.96,4,in stock
howl and other poems,40.45,2,in stock
history of beauty,10.29,4,in stock
heaven is for real a little boys astounding story of his trip to heaven and back,52.86,2,in stock
future shock future shock 1,55.65,5,in stock
enders game the ender quintet 1,43.64,1,in stock
diary of a citizen scientist chasing tiger beetles and other new ways of engaging the world,28.41,1,in stock
death by leisure a cautionary tale,37.51,4,in stock
brilliant beacons a history of the american lighthouse,11.45,3,in stock
brazen the courage to find the you thats been hiding,19.22,2,in stock
between the world and me,56.91,4,in stock
being mortal medicine and what matters in the end,55.06,4,in stock
a murder over a girl justice gender junior high,13.2,3,in stock
32 yolks,53.63,2,in stock
most blessed of the patriarchs thomas jefferson and the empire of the imagination,44.48,5,in stock
you are a badass how to stop doubting your greatness and start living an awesome life,12.08,3,in stock
wildlife of new york a fiveborough coloring book,22.14,2,in stock
what happened on beale street secrets of the south mysteries 2,25.37,5,in stock
unreasonable hope finding faith in the god who brings purpose to your pain,46.33,2,in stock
under the tuscan sun,37.33,3,in stock
toddlers are aholes its not your fault,25.55,1,in stock
the year of living biblically one mans humble quest to follow the bible as literally as possible,34.72,1,in stock
the whale,35.96,4,in stock
the story of art,41.14,4,in stock
the origin of species,10.01,4,in stock
the great gatsby,36.05,4,in stock
the good girl,49.03,3,in stock
the glass castle,16.24,1,in stock
the faith of christopher hitchens the restless soul of the worlds most notorious atheist,39.55,1,in stock
the drowning girls,35.67,3,in stock
the constant princess the tudor court 1,16.62,3,in stock
the bourne identity jason bourne 1,42.78,4,in stock
the bachelor girls guide to murder herringford and watts mysteries 1,52.3,5,in stock
the art book,32.34,2,in stock
the 7 habits of highly effective people powerful lessons in personal change,33.17,4,in stock
team of rivals the political genius of abraham lincoln,20.12,5,in stock
steal like an artist 10 things nobody told you about being creative,20.9,2,in stock
sit stay love,20.9,3,in stock
sister dear,40.2,4,in stock
shrunken treasures literary classics short sweet and silly,52.87,3,in stock
rich dad poor dad,51.74,1,in stock
raymie nightingale,34.41,2,in stock
playing from the heart,32.38,1,in stock
nightstruck a novel,50.35,4,in stock
naturally lean 125 nourishing glutenfree plantbased recipesall under 300 calories,11.38,5,in stock
meternity,43.58,3,in stock
memoirs of a geisha,49.67,3,in stock
like never before walker family 2,28.77,2,in stock
life of pi,13.22,4,in stock
leave this song behind teen poetry at its best,51.17,5,in stock
kings folly the kinsman chronicles 1,39.61,5,in stock
john adams,57.43,4,in stock
how to cook everything vegetarian simple meatless recipes for great food how to cook everything,46.01,4,in stock
how to be a domestic goddess baking and the art of comfort cooking,28.25,2,in stock
good in bed cannie shapiro 1,37.05,5,in stock
fruits basket vol 7 fruits basket 7,19.57,1,in stock
for the love fighting for grace in a world of impossible standards,45.13,3,in stock
finding god in the ruins how god redeems pain,46.64,2,in stock
every heart a doorway every heart a doorway 1,12.16,5,in stock
delivering the truth quaker midwife mystery 1,20.89,4,in stock
counted with the stars out from egypt 1,17.97,5,in stock
chronicles vol 1,52.6,2,in stock
blue like jazz nonreligious thoughts on christian spirituality,25.77,1,in stock
benjamin franklin an american life,48.19,3,in stock
at the existentialist caf freedom being and apricot cocktails with jeanpaul sartre simone de beauvoir albert camus martin heidegger edmund husserl karl jaspers maurice merleauponty and others,29.93,5,in stock
a summer in europe,44.34,2,in stock
a short history of nearly everything,52.4,5,in stock
a gathering of shadows shades of magic 2,44.81,4,in stock
the sound of love,57.84,5,in stock
the rise and fall of the third reich a history of nazi germany,39.67,2,in stock
the perks of being a wallflower,55.02,3,in stock
the mysterious affair at styles hercule poirot 1,24.8,4,in stock
the man who mistook his wife for a hat and other clinical tales,59.45,4,in stock
the makings of a fatherless child,31.58,2,in stock
the joy of cooking,43.27,4,in stock
the invention of wings,37.34,1,in stock
the hobbit middleearth universe,17.8,5,in stock
the great railway bazaar,30.54,1,in stock
the golden compass his dark materials 1,18.77,1,in stock
the god delusion,46.85,3,in stock
the girl you left behind the girl you left behind 1,15.79,1,in stock
the fellowship of the ring the lord of the rings 1,10.27,2,in stock
the collected poems of wb yeats the collected works of wb yeats 1,15.42,5,in stock
the barefoot contessa cookbook,59.92,5,in stock
tell the wolves im home,50.96,2,in stock
ship leaves harbor essays on travel by a recovering journeyman,30.6,3,in stock
pride and prejudice,19.27,4,in stock
musicophilia tales of music and the brain,46.58,1,in stock
mere christianity,48.51,3,in stock
me before you me before you 1,19.02,1,in stock
in the woods dublin murder squad 1,38.38,2,in stock
in cold blood,49.98,4,in stock
how to stop worrying and start living,46.49,5,in stock
give it back,18.32,2,in stock
girl interrupted,42.14,3,in stock
fun home a family tragicomic,56.59,4,in stock
fruits basket vol 6 fruits basket 6,20.96,4,in stock
deception point,40.32,4,in stock
death note vol 6 giveandtake death note 6,36.39,3,in stock
catherine the great portrait of a woman,58.55,4,in stock
better homes and gardens new cook book,39.61,3,in stock
an unquiet mind a memoir of moods and madness,21.3,3,in stock
a year in provence provence 1,56.88,4,in stock
world without end the pillars of the earth 2,32.97,4,in stock
will grayson will grayson will grayson will grayson,47.31,4,in stock
why save the bankers and other essays on our economic and political crisis,48.67,2,in stock
where she went if i stay 2,41.73,4,in stock
what if serious scientific answers to absurd hypothetical questions,53.68,4,in stock
two summers,14.64,1,in stock
this is your brain on music the science of a human obsession,38.4,1,in stock
the secret garden,15.08,4,in stock
the raven king the raven cycle 4,30.57,2,in stock
the raven boys the raven cycle 1,57.74,4,in stock
the power greens cookbook 140 delicious superfood recipes,11.05,5,in stock
the metamorphosis,28.58,1,in stock
the mathews men seven brothers and the war against hitlers uboats,42.91,5,in stock
the little paris bookshop,24.73,3,in stock
the hiding place,55.91,4,in stock
the grand design,13.76,3,in stock
the firm,45.56,3,in stock
the fault in our stars,47.22,1,in stock
the false prince the ascendance trilogy 1,56.0,5,in stock
the expatriates,44.58,2,in stock
the dream thieves the raven cycle 2,34.5,1,in stock
the darkest corners,11.33,5,in stock
the crossover,38.77,4,in stock
the 5th wave the 5th wave 1,11.83,2,in stock
tell the wind and fire,45.51,3,in stock
tell me three things,41.81,1,in stock
talking to girls about duran duran one young mans quest for true love and a cooler haircut,25.15,4,in stock
siddhartha,34.22,5,in stock
shiver the wolves of mercy falls 1,16.23,5,in stock
remember me,11.48,3,in stock
red dragon hannibal lecter 1,23.37,3,in stock
peak secrets from the new science of expertise,16.28,2,in stock
my mother was nuts,31.63,4,in stock
mexican today new and rediscovered recipes for contemporary kitchens,24.91,5,in stock
maybe something beautiful how art transformed a neighborhood,22.54,1,in stock
lola and the boy next door anna and the french kiss 2,23.63,4,in stock
logan kade fallen crest high 55,13.12,2,in stock
last one home new beginnings 1,59.98,3,in stock
killing floor jack reacher 1,31.49,4,in stock
kill the boy band,15.52,5,in stock
isla and the happily ever after anna and the french kiss 3,48.13,5,in stock
if i stay if i stay 1,38.13,5,in stock
i know why the caged bird sings maya angelous autobiography 1,36.55,2,in stock
harry potter and the deathly hallows harry potter 7,23.32,1,in stock
fruits basket vol 5 fruits basket 5,16.33,1,in stock
foundation foundation publication order 1,32.42,1,in stock
fool me once,16.96,1,in stock
find her detective dd warren 8,22.37,1,in stock
evicted poverty and profit in the american city,42.27,1,in stock
drama,38.7,2,in stock
dracula the undead,35.63,5,in stock
digital fortress,58.0,5,in stock
death note vol 5 whiteout death note 5,52.41,1,in stock
data a love story how i gamed online dating to meet my match,32.35,3,in stock
critique of pure reason,20.75,1,in stock
booked,17.49,5,in stock
blue lily lily blue the raven cycle 3,34.13,5,in stock
approval junkie adventures in caring too much,58.81,5,in stock
an abundance of katherines,10.0,5,in stock
americas war for the greater middle east a military history,51.22,2,in stock
alight the generations trilogy 2,58.59,4,in stock
a girls guide to moving on new beginnings 2,31.3,1,in stock
a game of thrones a song of ice and fire 1,46.42,2,in stock
a feast for crows a song of ice and fire 4,17.21,4,in stock
a clash of kings a song of ice and fire 2,10.79,3,in stock
vogue colors a to z a fashion coloring book,52.35,4,in stock
the shining the shining 1,27.88,3,in stock
the pilgrims progress,50.26,2,in stock
the perfect play play by play 1,59.99,3,in stock
the passion of dolssa,28.32,5,in stock
the jazz of physics the secret link between music and the structure of the universe,38.71,3,in stock
the hunger games the hunger games 1,29.85,5,in stock
the hound of the baskervilles sherlock holmes 5,14.82,2,in stock
the gunning of america business and the making of american gun culture,16.81,4,in stock
the geography of bliss one grumps search for the happiest places in the world,28.23,2,in stock
the demonists demonist 1,52.11,2,in stock
the demon prince of momochi house vol 4 the demon prince of momochi house 4,27.88,2,in stock
the bone hunters lexy vaughan  steven macaulay 2,59.71,3,in stock
the beast black dagger brotherhood 14,46.08,5,in stock
some women,13.73,5,in stock
shopaholic ties the knot shopaholic 3,48.39,5,in stock
paper and fire the great library 2,49.45,5,in stock
outlander outlander 1,19.67,5,in stock
orchestra of exiles the story of bronislaw huberman the israel philharmonic and the one thousand jews he saved from nazi horrors,12.36,3,in stock
no one here gets out alive,20.02,5,in stock
night shift night shift 120,12.75,4,in stock
needful things,47.51,4,in stock
mockingjay the hunger games 3,20.44,4,in stock
misery,34.79,2,in stock
little women little women 1,28.07,4,in stock
it,25.01,3,in stock
harry potter and the sorcerers stone harry potter 1,13.9,3,in stock
harry potter and the prisoner of azkaban harry potter 3,24.17,4,in stock
harry potter and the order of the phoenix harry potter 5,31.63,4,in stock
harry potter and the halfblood prince harry potter 6,48.75,5,in stock
harry potter and the chamber of secrets harry potter 2,14.74,1,in stock
gone with the wind,32.49,3,in stock
god is not great how religion poisons everything,27.8,1,in stock
girl with a pearl earring,26.77,1,in stock
fruits basket vol 4 fruits basket 4,50.44,4,in stock
far from true promise falls trilogy 2,34.93,2,in stock
dark lover black dagger brotherhood 1,12.87,1,in stock
confessions of a shopaholic shopaholic 1,48.94,2,in stock
changing the game play by play 2,13.38,3,in stock
candide,58.63,3,in stock
can you keep a secret,21.94,1,in stock
atlas shrugged,26.58,5,in stock
animal farm,57.22,3,in stock
a walk to remember,56.43,1,in stock
a new earth awakening to your lifes purpose,55.65,5,in stock
a history of god the 4000year quest of judaism christianity and islam,27.62,1,in stock
salems lot,49.56,4,in stock
zero history blue ant 3,34.77,1,in stock
wuthering heights,17.73,3,in stock
world war z an oral history of the zombie war,21.8,1,in stock
wild from lost to found on the pacific crest trail,46.02,3,in stock
whered you go bernadette,18.13,1,in stock
when you are engulfed in flames,30.89,5,in stock
we the people the modernday figures who have reshaped and affirmed the founding fathers vision of america,31.95,3,in stock
we are all completely beside ourselves,24.04,1,in stock
walk the edge thunder road 2,32.36,3,in stock
voyager outlander 3,21.07,5,in stock
very good lives the fringe benefits of failure and the importance of imagination,50.66,3,in stock
vegan vegetarian omnivore dinner for everyone at the table,13.66,2,in stock
unstuffed decluttering your home mind and soul,58.09,1,in stock
under the banner of heaven a story of violent faith,30.0,1,in stock
two boys kissing,32.74,2,in stock
twilight twilight 1,41.93,2,in stock
twenties girl,42.8,2,in stock
trespassing across america one mans epic neverdonebefore and sort of illegal hike across the heartland,53.51,1,in stock
threemartini lunch,23.21,3,in stock
thinking fast and slow,21.14,1,in stock
the wild robot,56.07,3,in stock
the wicked  the divine vol 3 commercial suicide the wicked  the divine,14.41,3,in stock
the undomestic goddess,45.75,4,in stock
the travelers,15.77,1,in stock
the tipping point how little things can make a big difference,10.02,2,in stock
the thing about jellyfish,48.77,1,in stock
the stand,57.86,2,in stock
the smitten kitchen cookbook,23.59,1,in stock
the silkworm cormoran strike 2,23.05,5,in stock
the sandman vol 3 dream country the sandman volumes 3,55.55,5,in stock
the rose  the dagger the wrath and the dawn 2,58.64,4,in stock
the road to little dribbling adventures of an american in britain notes from a small island 2,23.21,1,in stock
the rise of theodore roosevelt theodore roosevelt 1,42.57,3,in stock
the restaurant at the end of the universe hitchhikers guide to the galaxy 2,10.92,1,in stock
the rest is noise listening to the twentieth century,34.77,1,in stock
the red tent,35.66,5,in stock
the purpose driven life what on earth am i here for,37.19,3,in stock
the purest hook second circle tattoos 3,12.25,1,in stock
the picture of dorian gray,29.7,2,in stock
the paris wife,36.8,3,in stock
the obsession,45.43,1,in stock
the nightingale,26.26,4,in stock
the new guy and other senior year distractions,44.92,3,in stock
the nanny diaries nanny 1,52.53,5,in stock
the name of god is mercy,37.25,2,in stock
the maze runner the maze runner 1,20.93,1,in stock
the lovers dictionary,58.09,2,in stock
the lonely ones,43.59,5,in stock
the lean startup how todays entrepreneurs use continuous innovation to create radically successful businesses,33.92,3,in stock
the last painting of sara de vos,55.55,2,in stock
the land of 10000 madonnas,29.64,4,in stock
the infinities,27.41,1,in stock
the husbands secret,52.51,5,in stock
the hitchhikers guide to the galaxy hitchhikers guide to the galaxy 1,47.8,3,in stock
the guns of august,14.54,2,in stock
the guernsey literary and potato peel pie society,49.53,1,in stock
the goldfinch,43.58,3,in stock
the giver the giver quartet 1,12.3,1,in stock
the girl with all the gifts,49.47,3,in stock
the girl who played with fire millennium trilogy 2,22.14,2,in stock
the girl who kicked the hornets nest millennium trilogy 3,57.48,1,in stock
the exiled,43.45,3,in stock
the end of faith religion terror and the future of reason,22.13,4,in stock
the elegant universe superstrings hidden dimensions and the quest for the ultimate theory,13.03,4,in stock
the disappearing spoon and other true tales of madness love and the history of the world from the periodic table of the elements,57.35,5,in stock
the devil wears prada the devil wears prada 1,44.29,1,in stock
the demonhaunted world science as a candle in the dark,52.25,4,in stock
the day the crayons came home crayons,26.33,5,in stock
the da vinci code robert langdon 2,22.96,2,in stock
the cuckoos calling cormoran strike 1,19.21,1,in stock
the complete stories and poems the works of edgar allan poe cameo edition,26.78,4,in stock
the complete poems,41.32,5,in stock
the catcher in the rye,24.55,1,in stock
the cat in the hat beginner books b1,16.26,2,in stock
the case for christ cases for christianity,47.84,1,in stock
the book thief,53.49,2,in stock
the book of basketball the nba according to the sports guy,44.84,5,in stock
the blind side evolution of a game,53.71,5,in stock
the autobiography of malcolm x,23.43,2,in stock
the art of simple food notes lessons and recipes from a delicious revolution,34.32,3,in stock
the art of fielding,22.1,1,in stock
surely youre joking mr feynman adventures of a curious character,25.83,2,in stock
stiff the curious lives of human cadavers,36.74,3,in stock
spilled milk based on a true story,49.51,1,in stock
something borrowed darcy  rachel 1,48.96,5,in stock
something blue darcy  rachel 2,54.62,1,in stock
soldier talon 3,24.72,2,in stock
shopaholic  baby shopaholic 5,46.45,2,in stock
seven days in the art world,52.33,2,in stock
seven brief lessons on physics,30.6,4,in stock
scarlet the lunar chronicles 2,14.57,4,in stock
sarahs key,46.29,1,in stock
saga volume 3 saga collected editions 3,21.57,5,in stock
running with scissors,12.91,4,in stock
rogue lawyer rogue lawyer 1,50.11,3,in stock
rise of the rocket girls the women who propelled us from missiles to the moon to mars,41.67,4,in stock
rework,44.88,2,in stock
reservations for two,11.1,3,in stock
red the true story of red riding hood,28.54,3,in stock
ready player one,19.07,4,in stock
quiet the power of introverts in a world that cant stop talking,43.55,1,in stock
prodigy the graphic novel legend the graphic novel 2,43.63,3,in stock
persepolis the story of a childhood persepolis 12,39.13,1,in stock
packing for mars the curious science of life in the void,56.68,2,in stock
outliers the story of success,14.16,1,in stock
original fake,31.45,3,in stock
orange is the new black,24.61,2,in stock
one for the money stephanie plum 1,32.87,2,in stock
notes from a small island notes from a small island 1,40.17,1,in stock
night the night trilogy 1,13.51,1,in stock
neither here nor there travels in europe,38.95,3,in stock
naked,31.69,3,in stock
morning star red rising 3,29.4,1,in stock
miracles from heaven a little girl her journey to heaven and her amazing story of healing,57.83,1,in stock
midnight riot peter grant rivers of london  books 1,55.46,2,in stock
me talk pretty one day,57.6,2,in stock
manuscript found in accra,34.98,2,in stock
lust  wonder,11.87,2,in stock
lila gilead 3,12.47,3,in stock
life the universe and everything hitchhikers guide to the galaxy 3,33.26,2,in stock
life without a recipe,59.04,5,in stock
life after life,26.13,2,in stock
letter to a christian nation,22.2,1,in stock
lets pretend this never happened a mostly true memoir,45.11,1,in stock
legend legend 1,43.69,4,in stock
lean in women work and the will to lead,25.02,1,in stock
lamb the gospel according to biff christs childhood pal,55.5,5,in stock
lady renegades rebel belle 3,53.04,5,in stock
jurassic park jurassic park 1,44.97,1,in stock
its never too late to begin again discovering creativity and meaning at midlife and beyond,42.38,1,in stock
is everyone hanging out without me and other concerns,20.11,3,in stock
into the wild,56.7,5,in stock
inferno robert langdon 4,41.0,5,in stock
in the garden of beasts love terror and an american family in hitlers berlin,28.85,3,in stock
if i run if i run 1,49.97,4,in stock
ive got your number,19.69,1,in stock
i am malala the girl who stood up for education and was shot by the taliban,28.88,2,in stock
hungry girl clean  hungry easy allnatural recipes for healthy eating in the real world,33.14,3,in stock
house of lost worlds dinosaurs dynasties and the story of life on earth,43.7,2,in stock
house of leaves,54.89,1,in stock
horrible bear,37.52,2,in stock
holidays on ice,51.07,2,in stock
heir to the sky,44.07,4,in stock
green eggs and ham beginner books b16,10.79,4,in stock
grayson vol 3 nemesis grayson 3,42.72,1,in stock
gratitude,26.66,5,in stock
gone girl,37.6,5,in stock
golden heart of dread 3,42.21,4,in stock
girl in the blue coat,46.83,2,in stock
fruits basket vol 3 fruits basket 3,45.17,2,in stock
friday night lights a town a team and a dream,51.22,3,in stock
fire bound sea havensisters of the heart 5,21.28,4,in stock
fifty shades freed fifty shades 3,15.36,5,in stock
fellside,38.62,1,in stock
extreme prey lucas davenport 26,25.4,3,in stock
eragon the inheritance cycle 1,43.87,3,in stock
eclipse twilight 3,18.74,1,in stock
dune dune 1,54.86,1,in stock
dracula,52.62,3,in stock
do androids dream of electric sheep blade runner 1,51.48,1,in stock
disrupted my misadventure in the startup bubble,15.28,5,in stock
dead wake the last crossing of the lusitania,39.24,5,in stock
david and goliath underdogs misfits and the art of battling giants,17.81,1,in stock
darkfever fever 1,56.02,1,in stock
dark places,23.9,5,in stock
crazy rich asians crazy rich asians 1,49.13,5,in stock
counting thyme,10.62,1,in stock
cosmos,36.17,2,in stock
civilization and its discontents,59.95,2,in stock
cinder the lunar chronicles 1,26.09,1,in stock
catastrophic happiness finding joy in childhoods messy years,37.35,2,in stock
career of evil cormoran strike 3,24.72,2,in stock
breaking dawn twilight 4,35.28,5,in stock
brave enough,51.32,5,in stock
boy meets boy,21.12,3,in stock
born to run a hidden tribe superathletes and the greatest race the world has never seen,27.35,2,in stock
blink the power of thinking without thinking,21.74,5,in stock
black flags the rise of isis,40.87,1,in stock
black butler vol 1 black butler 1,49.31,1,in stock
big little lies,22.11,1,in stock
between shades of gray,20.79,5,in stock
best of my love fools gold 20,27.41,2,in stock
beowulf,38.35,2,in stock
beautiful creatures caster chronicles 1,21.55,5,in stock
awkward,38.02,2,in stock
ash,22.06,4,in stock
are we there yet,10.66,3,in stock
are we smart enough to know how smart animals are,56.58,1,in stock
annie on my mind,36.83,5,in stock
and then there were none,35.01,2,in stock
a walk in the woods rediscovering america on the appalachian trail,30.48,4,in stock
a visit from the goon squad,14.08,5,in stock
a storm of swords a song of ice and fire 3,31.22,2,in stock
a heartbreaking work of staggering genius,54.29,5,in stock
8 keys to mental health through exercise,31.04,1,in stock
girlboss,50.96,1,in stock
the suffragettes little black classics 96,11.89,2,in stock
the sense of an ending,31.38,3,in stock
the sandman vol 2 the dolls house the sandman volumes 2,54.81,1,in stock
the course of love,16.78,3,in stock
sugar rush offensive line 2,24.42,1,in stock
saga volume 2 saga collected editions 2,11.75,3,in stock
run spot run the ethics of keeping pets,20.02,1,in stock
new moon twilight 2,12.86,4,in stock
life,31.58,5,in stock
kindle paperwhite users guide,34.0,3,in stock
h is for hawk,57.42,5,in stock
girl online on tour girl online 2,53.47,1,in stock
fruits basket vol 2 fruits basket 2,11.64,5,in stock
diary of a minecraft zombie book 1 a scare of a dare an unofficial minecraft book,52.88,4,in stock
y the last man vol 1 unmanned y the last man 1,18.51,4,in stock
while you were mine,41.32,5,in stock
where lightning strikes bleeding stars 3,39.77,3,in stock
when im gone,51.96,3,in stock
ways of seeing,39.51,5,in stock
vampire knight vol 1 vampire knight 1,15.4,1,in stock
vampire girl vampire girl 1,53.82,2,in stock
twenty love poems and a song of despair,30.95,4,in stock
travels with charley in search of america,57.82,5,in stock
three wishes river of time california 1,44.18,2,in stock
this one moment pushing limits 1,48.71,1,in stock
the zombie room,19.69,5,in stock
the wicked  the divine vol 1 the faust act the wicked  the divine,36.52,2,in stock
the tumor,41.56,5,in stock
the story of hong gildong,43.19,4,in stock
the silent wife,12.34,5,in stock
the silent twin detective jennifer knight 3,36.25,3,in stock
the selfish gene,29.45,1,in stock
the secret healer,34.56,3,in stock
the sandman vol 1 preludes and nocturnes the sandman volumes 1,54.12,3,in stock
the republic,33.78,3,in stock
the odyssey,29.64,3,in stock
the no 1 ladies detective agency no 1 ladies detective agency 1,57.7,4,in stock
the nicomachean ethics,36.34,1,in stock
the name of the wind the kingkiller chronicle 1,50.59,3,in stock
the mirror  the maze the wrath and the dawn 15,29.38,1,in stock
the little prince,45.42,2,in stock
the light of the fireflies,54.43,1,in stock
