title,price,rating,availability
a light in the attic,51.77,3,in stock
tipping the velvet,53.74,1,in stock
soumission,50.1,1,in stock
sharp objects,47.82,4,in stock
sapiens a brief history of humankind,54.23,5,in stock
the requiem red,22.65,1,in stock
the dirty little secrets of getting your dream job,33.34,4,in stock
the coming woman a novel based on the life of the infamous feminist victoria woodhull,17.93,3,in stock
the boys in the boat nine americans and their epic quest for gold at the 1936 berlin olympics,22.6,4,in stock
the black maria,52.15,1,in stock
starving hearts triangular trade trilogy 1,13.99,2,in stock
shakespeares sonnets,20.66,4,in stock
set me free,17.46,5,in stock
scott pilgrims precious little life scott pilgrim 1,52.29,5,in stock
rip it up and start again,35.02,5,in stock
our band could be your life scenes from the american indie underground 19811991,57.25,3,in stock
olio,23.88,1,in stock
mesaerion the best science fiction stories 18001849,37.59,1,in stock
libertarianism for beginners,51.33,2,in stock
its only the himalayas,45.17,2,in stock
in her wake,12.84,1,in stock
how music works,37.32,2,in stock
foolproof preserving a guide to small batch jams jellies pickles condiments and more a foolproof guide to making small batch jams jellies pickles condiments and more,30.52,3,in stock
chase me paris nights 2,25.27,5,in stock
black dust,34.53,5,in stock
birdsong a story in pictures,54.64,3,in stock
americas cradle of quarterbacks western pennsylvanias football factory from johnny unitas to joe montana,22.5,3,in stock
aladdin and his wonderful lamp,53.13,3,in stock
worlds elsewhere journeys around shakespeares globe,40.3,5,in stock
wall and piece,44.18,4,in stock
the four agreements a practical guide to personal freedom,17.66,5,in stock
the five love languages how to express heartfelt commitment to your mate,31.05,3,in stock
the elephant tree,23.82,5,in stock
the bear and the piano,36.89,1,in stock
sophies world,15.94,5,in stock
penny maybe,33.29,3,in stock
maude 18831993she grew up with the country,18.02,2,in stock
in a dark dark wood,19.63,1,in stock
behind closed doors,52.22,4,in stock
you cant bury them all poems,33.63,2,in stock
slow states of collapse poems,57.31,3,in stock
reasons to stay alive,26.41,2,in stock
private paris private 10,47.61,5,in stock
higherselfie wake up your life free your soul find your tribe,23.11,5,in stock
without borders wanderlove 1,45.07,2,in stock
when we collided,31.77,1,in stock
we love you charlie freeman,50.27,5,in stock
untitled collection sabbath poems 2014,14.27,4,in stock
unseen city the majesty of pigeons the discreet charm of snails  other wonders of the urban wilderness,44.18,4,in stock
unicorn tracks,18.78,3,in stock
unbound how eight technologies made us human transformed society and brought our world to the brink,25.52,1,in stock
tsubasa world chronicle 2 tsubasa world chronicle 2,16.28,1,in stock
throwing rocks at the google bus how growth became the enemy of prosperity,31.12,3,in stock
this one summer,19.49,4,in stock
thirst,17.27,5,in stock
the torch is passed a harding family story,19.09,1,in stock
the secret of dreadwillow carse,56.13,1,in stock
the pioneer woman cooks dinnertime comfort classics freezer food 16minute meals and other delicious ways to solve supper,56.41,1,in stock
the past never ends,56.5,4,in stock
the natural history of us the fine art of pretending 2,45.22,3,in stock
the nameless city the nameless city 1,38.16,4,in stock
the murder that never was forensic instincts 5,54.11,3,in stock
the most perfect thing inside and outside a birds egg,42.96,4,in stock
the mindfulness and acceptance workbook for anxiety a guide to breaking free from anxiety phobias and worry using acceptance and commitment therapy,23.89,4,in stock
the lifechanging magic of tidying up the japanese art of decluttering and organizing,16.77,3,in stock
the inefficiency assassin time management tactics for working smarter not longer,20.59,5,in stock
the gutsy girl escapades for your life of epic adventure,37.13,1,in stock
the electric pencil drawings from inside state hospital no 3,56.06,1,in stock
the death of humanity and the case for life,58.11,4,in stock
the bulletproof diet lose up to a pound a day reclaim energy and focus upgrade your life,49.05,3,in stock
the art forger,40.76,3,in stock
the age of genius the seventeenth century and the birth of the modern mind,19.73,1,in stock
the activists tao te ching ancient advice for a modern revolution,32.24,5,in stock
spark joy an illustrated master class on the art of organizing and tidying up,41.83,4,in stock
soul reader,39.58,2,in stock
security,39.25,2,in stock
saga volume 6 saga collected editions 6,25.02,3,in stock
saga volume 5 saga collected editions 5,51.04,2,in stock
reskilling america learning to labor in the twentyfirst century,19.83,2,in stock
rat queens vol 3 demons rat queens collected editions 1115,50.4,3,in stock
princess jellyfish 2in1 omnibus vol 01 princess jellyfish 2in1 omnibus 1,13.61,5,in stock
princess between worlds wideawake princess 5,13.34,5,in stock
pop gun war volume 1 gift,18.97,1,in stock
political suicide missteps peccadilloes bad calls backroom hijinx sordid pasts rotten breaks and just plain dumb mistakes in the annals of american politics,36.28,2,in stock
patience,10.16,3,in stock
outcast vol 1 a darkness surrounds him outcast 1,15.44,4,in stock
orange the complete collection 1 orange the complete collection 1,48.41,1,in stock
online marketing for busy authors a stepbystep guide,46.35,1,in stock
on a midnight clear,14.07,3,in stock
obsidian lux 1,14.86,2,in stock
my paris kitchen recipes and stories,33.37,2,in stock
masks and shadows,56.4,2,in stock
mama tried traditional italian cooking for the screwed crude vegan and tattooed,14.02,4,in stock
lumberjanes vol 2 friendship to the max lumberjanes 58,46.91,2,in stock
lumberjanes vol 1 beware the kitten holy lumberjanes 14,45.61,3,in stock
lumberjanes vol 3 a terrible plan lumberjanes 912,19.92,2,in stock
layered baking building and styling spectacular cakes,40.11,1,in stock
judo seven steps to black belt an introductory guide for beginners,53.9,2,in stock
join,35.67,5,in stock
in the country we love my family divided,22.0,4,in stock
immunity how elie metchnikoff changed the course of modern medicine,57.36,5,in stock
i hate fairyland vol 1 madly ever after i hate fairyland compilations 15,29.17,2,in stock
i am a hero omnibus volume 1,54.63,3,in stock
how to be miserable 40 strategies you already use,46.03,1,in stock
her backup boyfriend the sorensen family 1,33.97,1,in stock
giant days vol 2 giant days 58,22.11,2,in stock
forever and forever the courtship of henry longfellow and fanny appleton,29.69,3,in stock
first and first five boroughs 3,15.97,4,in stock
fifty shades darker fifty shades 2,21.96,1,in stock
everydata the misinformation hidden in the little data you consume every day,54.35,2,in stock
dont be a jerk and other practical advice from dogen japans greatest zen master,37.97,2,in stock
danganronpa volume 1,51.99,4,in stock
crown of midnight throne of glass 2,43.29,3,in stock
codename baboushka volume 1 the conclave of death,36.72,4,in stock
camp midnight,17.08,4,in stock
call the nurse true stories of a country nurse on a scottish isle,29.14,5,in stock
burning,28.81,3,in stock
bossypants,49.46,2,in stock
bitch planet vol 1 extraordinary machine bitch planet collected editions,37.92,2,in stock
avatar the last airbender smoke and shadow part 3 smoke and shadow 3,28.09,2,in stock
algorithms to live by the computer science of human decisions,30.81,1,in stock
a world of flavor your gluten free passport,42.95,1,in stock
a piece of sky a grain of rice a memoir in four meditations,56.76,5,in stock
a murder in time,16.64,1,in stock
a flight of arrows the pathfinders 2,55.53,5,in stock
a fierce and subtle poison,28.13,4,in stock
a court of thorns and roses a court of thorns and roses 1,52.37,1,in stock
unqualified how god uses broken people to do big things,54.0,5,in stock
you are what you love the spiritual power of habit,21.87,4,in stock
william shakespeares star wars verily a new hope william shakespeares star wars 4,43.3,4,in stock
tuesday nights in 1980,21.04,2,in stock
tracing numbers on a train,41.6,3,in stock
throne of glass throne of glass 1,35.07,3,in stock
thomas jefferson and the tripoli pirates the forgotten war that changed american history,59.64,1,in stock
thirteen reasons why,52.72,1,in stock
the white cat and the monk a retelling of the poem pangur bn,58.08,4,in stock
the wedding dress,24.12,1,in stock
the vacationers,42.15,4,in stock
the third wave an entrepreneurs vision of the future,12.61,5,in stock
the stranger,17.44,4,in stock
the shadow hero the shadow hero,33.14,1,in stock
the secret the secret 1,27.37,4,in stock
the regional office is under attack,51.36,5,in stock
the psychopath test a journey through the madness industry,36.0,2,in stock
the project,10.65,1,in stock
the power of now a guide to spiritual enlightenment,43.54,2,in stock
the omnivores dilemma a natural history of four meals,38.21,2,in stock
the nerdy nummies cookbook sweet treats for the geek in all of us,37.34,5,in stock
the murder of roger ackroyd hercule poirot 4,44.1,4,in stock
the mistake offcampus 2,43.29,3,in stock
the matchmakers playbook wingmen inc 1,55.85,1,in stock
the love and lemons cookbook an appletozucchini celebration of impromptu cooking,37.6,2,in stock
the long shadow of small ghosts murder and memory in an american city,10.97,1,in stock
the kite runner,41.82,4,in stock
the house by the lake,36.95,1,in stock
the glittering court the glittering court 1,44.28,1,in stock
the girl on the train,55.02,2,in stock
the genius of birds,17.24,1,in stock
the emerald mystery,23.15,2,in stock
the cookies  cups cookbook 125 sweet  savory recipes reminding you to always eat dessert first,41.25,1,in stock
the bridge to consciousness im writing the bridge between science and our old and new beliefs,32.0,3,in stock
the artists way a spiritual path to higher creativity,38.49,5,in stock
the art of war,33.34,5,in stock
the argonauts,10.93,2,in stock
the 10 entrepreneur live your startup dream without quitting your day job,27.55,3,in stock
suddenly in love lake haven 1,55.99,2,in stock
something more than this,16.24,4,in stock
soft apocalypse,26.12,2,in stock
so youve been publicly shamed,12.23,2,in stock
shoe dog a memoir by the creator of nike,23.99,2,in stock
shobu samurai project aryoku 3,29.06,3,in stock
secrets and lace fatal hearts 1,20.27,1,in stock
scarlett epstein hates it here,43.55,5,in stock
romero and juliet a tragic tale of love and zombies,36.94,1,in stock
redeeming love,20.47,5,in stock
poses for artists volume 1  dynamic and sitting poses an essential reference for figure drawing and the human form,41.06,1,in stock
poems that make grown women cry,14.19,4,in stock
nightingale sing,38.28,1,in stock
night sky with exit wounds,41.05,1,in stock
mrs houdini,30.25,5,in stock
modern romance,28.26,5,in stock
miss peregrines home for peculiar children miss peregrines peculiar children 1,10.76,1,in stock
louisa the extraordinary life of mrs adams,16.85,2,in stock
little red,13.47,3,in stock
library of souls miss peregrines peculiar children 3,48.56,5,in stock
large print heart of the pride,19.15,2,in stock
i had a nice time and other lies how to find love  sht like that,57.36,4,in stock
hollow city miss peregrines peculiar children 2,42.98,1,in stock
grumbles,22.16,2,in stock
full moon over noahs ark an odyssey to mount ararat and beyond,49.43,4,in stock
frostbite vampire academy 2,29.99,5,in stock
follow you home,21.36,1,in stock
first steps for new christians print edition,29.0,1,in stock
finders keepers bill hodges trilogy 2,53.53,5,in stock
fables vol 1 legends in exile fables 1,41.62,4,in stock
eureka trivia 60,54.59,4,in stock
drive the surprising truth about what motivates us,34.95,4,in stock
done rubbed out reightman  bailey 1,37.72,5,in stock
doing it over most likely to 1,35.61,3,in stock
deliciously ella every day quick and easy recipes for glutenfree snacks packed lunches and simple meals,42.16,3,in stock
dark notes,19.19,5,in stock
daring greatly how the courage to be vulnerable transforms the way we live love parent and lead,19.43,3,in stock
close to you,49.46,4,in stock
chasing heaven what dying taught me about living,37.8,2,in stock
big magic creative living beyond fear,30.8,3,in stock
becoming wise an inquiry into the mystery and art of living,27.43,2,in stock
beauty restored riley family legacy novellas 3,11.11,2,in stock
batman the long halloween batman,36.5,2,in stock
batman the dark knight returns batman,15.38,5,in stock
ayumis violin,15.48,2,in stock
anonymous,46.82,4,in stock
amy meets the saints and sages,18.46,3,in stock
amid the chaos,36.58,1,in stock
amatus,50.54,5,in stock
agnostic a spirited manifesto,12.51,5,in stock
zealot the life and times of jesus of nazareth,24.7,3,in stock
you you 1,43.61,5,in stock
wonder woman earth one volume one wonder woman earth one 1,37.34,4,in stock
wild swans,14.36,2,in stock
why the right went wrong conservatismfrom goldwater to the tea party and beyond,52.65,4,in stock
whole lotta creativity going on 60 fun and unusual exercises to awaken and strengthen your creativity,38.2,4,in stock
whats it like in space stories from astronauts whove been there,19.6,2,in stock
we are robin vol 1 the vigilante business we are robin 1,53.9,1,in stock
walt disneys alice in wonderland,12.96,5,in stock
v for vendetta v for vendetta complete,37.1,4,in stock
until friday night the field party 1,46.31,2,in stock
unbroken a world war ii story of survival resilience and redemption,45.95,2,in stock
twenty yawns,22.08,2,in stock
through the woods,25.38,2,in stock
this is where it ends,27.12,2,in stock
the year of magical thinking,43.04,2,in stock
the wright brothers,56.8,4,in stock
the white queen the cousins war 1,25.91,5,in stock
the wedding pact the omalleys 2,32.61,3,in stock
the time keeper,27.88,5,in stock
the testament of mary,52.67,4,in stock
the startouched queen,46.02,5,in stock
the songs of the gods,44.48,5,in stock
the song of achilles,37.4,5,in stock
the rosie project don tillman 1,54.04,1,in stock
the power of habit why we do what we do in life and business,16.88,3,in stock
the marriage of opposites,28.08,4,in stock
the lucifer effect understanding how good people turn evil,10.4,1,in stock
the long haul diary of a wimpy kid 9,44.07,1,in stock
the loney,23.4,1,in stock
the literature book big ideas simply explained,17.43,3,in stock
the last mile amos decker 2,54.21,2,in stock
the immortal life of henrietta lacks,40.67,2,in stock
the hidden oracle the trials of apollo 1,52.26,2,in stock
the help yourself cookbook for kids 60 easy plantbased recipes kids can make to stay healthy and save the earth,28.77,3,in stock
the guilty will robie 4,13.82,2,in stock
the first hostage jb collins 2,25.85,3,in stock
the dovekeepers,48.78,1,in stock
the darkest lie,35.35,5,in stock
the bane chronicles the bane chronicles 111,44.73,4,in stock
the badass librarians of timbuktu and their race to save the worlds most precious manuscripts,15.77,1,in stock
the 14th colony cotton malone 11,39.24,1,in stock
that darkness gardiner and renner 1,13.92,1,in stock
tastes like fear di marnie rome 3,10.69,1,in stock
take me with you,45.21,3,in stock
swell a year of waves,45.58,1,in stock
superman vol 1 before truth superman by gene luen yang 1,11.89,5,in stock
still life with bread crumbs,26.41,3,in stock
steve jobs,39.5,5,in stock
sorting the beef from the bull the science of food fraud forensics,44.74,4,in stock
someone like you the harrisons 2,52.79,5,in stock
so cute it hurts vol 6 so cute it hurts 6,35.43,4,in stock
shtum,55.84,4,in stock
see america a celebration of our national parks  treasured sites,48.87,3,in stock
salt,46.78,4,in stock
robin war,47.82,3,in stock
red hoodarsenal vol 1 open for business red hoodarsenal 1,25.48,2,in stock
rain fish,23.57,3,in stock
quarter life poetry poems for the young broke and hangry,50.89,5,in stock
pet sematary,10.56,3,in stock
overload how to unplug unwind and unleash yourself from the pressure of stress,52.15,3,in stock
once was a time,18.28,2,in stock
old school diary of a wimpy kid 10,11.83,5,in stock
no dream is too high life lessons from a man who walked on the moon,21.95,2,in stock
naruto 3in1 edition vol 14 includes vols 40 41  42 naruto omnibus 14,38.39,2,in stock
my name is lucy barton,41.56,1,in stock
my mrs brown,24.48,3,in stock
my kind of crazy,40.36,1,in stock
mr mercedes bill hodges trilogy 1,28.9,1,in stock
more than music chasing the dream 1,37.61,2,in stock
made to stick why some ideas survive and others die,38.85,5,in stock
luis paints the world,53.95,3,in stock
luckiest girl alive,49.83,3,in stock
lowriders to the center of the earth lowriders in space 2,51.51,2,in stock
love is a mix tape music 1,18.03,1,in stock
looking for lovely collecting the moments that matter,29.14,5,in stock
living leadership by insight a good leader achieves a great leader builds monuments,46.91,4,in stock
let it out a journey through journaling,26.79,5,in stock
lady midnight the dark artifices 1,16.28,5,in stock
its all easy healthy delicious weeknight meals in under 30 minutes,19.55,1,in stock
island of dragons unwanteds 7,29.65,1,in stock
i know what im doing  and other lies i tell myself dispatches from a life under construction,25.98,4,in stock
i am pilgrim pilgrim 1,10.6,4,in stock
hyperbole and a half unfortunate situations flawed coping mechanisms mayhem and other things that happened,14.75,5,in stock
hush hush hush hush 1,47.02,3,in stock
hold your breath search and rescue 1,28.82,1,in stock
hamilton the revolution,58.79,3,in stock
greek mythic history,10.23,5,in stock
god the most unpleasant character in all fiction,30.03,5,in stock
glory over everything beyond the kitchen house,45.84,3,in stock
feathers displays of brilliant plumage,49.05,3,in stock
far  away places on the brink of change seven continents twentyfive years,15.06,4,in stock
every last word,46.47,3,in stock
eligible the austen project 4,27.09,3,in stock
el deafo,57.62,5,in stock
eight hundred grapes,14.39,4,in stock
eaternity more than 150 deliciously easy vegan recipes for a long healthy satisfied joyful life,51.75,5,in stock
eat fat get thin,54.07,2,in stock
dont get caught,55.35,1,in stock
doctor sleep the shining 2,40.12,2,in stock
demigods  magicians percy and annabeth meet the kanes percy jackson  kane chronicles crossover 13,37.51,5,in stock
dear mr knightley,11.21,5,in stock
daily fantasy sports,36.58,1,in stock
crazy love overwhelmed by a relentless god,47.72,2,in stock
cometh the hour the clifton chronicles 6,25.01,3,in stock
code name verity code name verity 1,22.13,4,in stock
clockwork angel the infernal devices 1,44.14,1,in stock
city of glass the mortal instruments 3,56.02,4,in stock
city of fallen angels the mortal instruments 4,11.23,4,in stock
city of bones the mortal instruments 1,43.28,1,in stock
city of ashes the mortal instruments 2,47.27,1,in stock
cell,20.29,4,in stock
catching jordan hundred oaks,50.83,3,in stock
carry on warrior thoughts on life unarmed,31.85,3,in stock
carrie,46.23,2,in stock
buying in the secret dialogue between what we buy and who we are,37.8,4,in stock
brain on fire my month of madness,49.32,5,in stock
batman europa,32.01,2,in stock
barefoot contessa back to basics,28.01,1,in stock
barefoot contessa at home everyday recipes youll make over and over again,50.62,5,in stock
balloon animals,17.03,3,in stock
art ops vol 1,48.8,3,in stock
aristotle and dante discover the secrets of the universe aristotle and dante discover the secrets of the universe 1,58.14,4,in stock
angels walking angels walking 1,34.2,2,in stock
angels  demons robert langdon 1,51.48,3,in stock
all the light we cannot see,29.87,5,in stock
adulthood is a myth a sarahs scribbles collection,10.9,2,in stock
abstract city,56.37,5,in stock
a time of torment charlie parker 14,48.35,5,in stock
a study in scarlet sherlock holmes 1,16.73,2,in stock
a series of catastrophes and miracles a true story of love science and cancer,56.48,2,in stock
a peoples history of the united states,40.79,2,in stock
a man called ove,39.72,1,in stock
a distant mirror the calamitous 14th century,14.58,3,in stock
a brush of wings angels walking 3,55.51,1,in stock
1491 new revelations of the americas before columbus,21.8,3,in stock
the three searches meaning and the story,13.33,3,in stock
searching for meaning in gailana,38.73,1,in stock
rook,37.86,4,in stock
my kitchen year 136 recipes that saved my life,11.53,2,in stock
13 hours the inside account of what really happened in benghazi,27.06,1,in stock
will you wont you want me,13.86,3,in stock
tipping point for planet earth how close are we to the edge,37.55,1,in stock
the startouched queen,32.3,5,in stock
the silent sister riley macpherson 1,46.29,5,in stock
the midnight watch a novel of the titanic and the californian,26.2,1,in stock
the lonely city adventures in the art of being alone,33.26,2,in stock
the gray rhino how to recognize and act on the obvious dangers we ignore,59.15,4,in stock
the golden condom and other essays on love lost and found,39.43,1,in stock
the epidemic the program 06,14.44,5,in stock
the dinner party,56.54,2,in stock
the diary of a young girl,59.9,3,in stock
the children,11.88,3,in stock
stars above the lunar chronicles 45,48.05,2,in stock
snatched how a drug queen went undercover for the dea and was kidnapped by colombian guerillas,21.21,3,in stock
raspberry pi electronics projects for the evil genius,49.67,4,in stock
quench your own thirst business lessons learned over a beer or two,43.14,1,in stock
psycho sanitarium psycho 15,36.97,5,in stock
poisonous max revere novels 3,26.8,3,in stock
one with you crossfire 5,15.71,4,in stock
no love allowed dodge cove 1,54.65,4,in stock
murder at the 42nd street library raymond ambler 1,54.36,4,in stock
most wanted,35.28,3,in stock
love lies and spies,20.55,2,in stock
how to speak golf an illustrated guide to links lingo,58.32,5,in stock
hide away eve duncan 20,11.84,1,in stock
furiously happy a funny book about horrible things,41.46,4,in stock
everyday italian 125 simple and delicious recipes,20.1,5,in stock
equal is unfair americas misguided fight against income inequality,56.86,1,in stock
eleanor  park,56.51,5,in stock
dirty dive bar 1,40.83,4,in stock
can you keep a secret fear street relaunch 4,48.64,1,in stock
boar island anna pigeon 19,59.48,3,in stock
a paris apartment,39.01,4,in stock
a la mode 120 recipes in 60 pairings pies tarts cakes crisps and more topped with ice cream gelato frozen custard and more,38.77,1,in stock
troublemaker surviving hollywood and scientology,48.39,2,in stock
the widow,27.26,2,in stock
the sleep revolution transforming your life one night at a time,11.68,4,in stock
the improbability of love,59.45,1,in stock
the art of startup fundraising,21.0,3,in stock
take me home tonight rock star romance 3,53.98,3,in stock
sleeping giants themis files 1,48.74,1,in stock
setting the world on fire the brief astonishing life of st catherine of siena,21.15,2,in stock
playing with fire,13.71,3,in stock
off the hook fishing for trouble 1,47.67,3,in stock
mothering sunday,13.34,2,in stock
mother can you not,16.89,5,in stock
m train,27.18,1,in stock
lilac girls,17.28,2,in stock
lies and other acts of love,45.14,1,in stock
lab girl,40.85,1,in stock
keep me posted,20.46,4,in stock
it didnt start with you how inherited family trauma shapes who we are and how to end the cycle,56.27,3,in stock
grey fifty shades 4,48.49,4,in stock
exit pursued by a bear,51.34,4,in stock
daredevils,16.34,3,in stock
cravings recipes for what you want to eat,20.5,3,in stock
born for this how to find the work you were meant to do,21.59,5,in stock
arena,21.36,4,in stock
adultery,20.88,5,in stock
a mothers reckoning living in the aftermath of tragedy,19.53,3,in stock
a gentlemans position society of gentlemen 3,14.75,5,in stock
112263,48.48,3,in stock
10 happier how i tamed the voice in my head reduced stress without losing my edge and found selfhelp that actually works,24.57,2,in stock
10day green smoothie cleanse lose up to 15 pounds in 10 days,49.71,5,in stock
without shame,48.27,5,in stock
watchmen,58.05,4,in stock
unlimited intuition now,58.87,4,in stock
underlying notes,11.82,2,in stock
the shack,28.03,1,in stock
the new brand you your new image makes the sale for you,44.05,5,in stock
the moosewood cookbook recipes from moosewood restaurant ithaca new york,12.34,4,in stock
the flowers lied,16.68,2,in stock
the fabric of the cosmos space time and the texture of reality,55.91,1,in stock
the book of mormon,24.57,3,in stock
the art and science of low carbohydrate living,52.98,5,in stock
the alien club,54.4,1,in stock
suzie snowflake one beautiful flake a selfesteem story,54.81,5,in stock
naparoo,25.08,1,in stock
nano what now finding your editing process revising your nanowrimo book and building a writing career through publishing and beyond,10.41,4,in stock
modern day fables,47.44,2,in stock
if i gave you gods phone number searching for spirituality in america,20.91,1,in stock
fruits basket vol 9 fruits basket 9,33.95,4,in stock
dress your family in corduroy and denim,43.68,3,in stock
dont forget steven,33.23,1,in stock
chernobyl 012340 the incredible true story of the worlds worst nuclear disaster,35.92,2,in stock
art and fear observations on the perils and rewards of artmaking,48.63,4,in stock
a shard of ice the black symphony saga 1,56.63,3,in stock
a heros curse the unseen chronicles 1,50.49,3,in stock
23 degrees south a tropical tale of changing whether,35.79,2,in stock
zero to one notes on startups or how to build the future,34.06,3,in stock
why not me,17.76,1,in stock
when breath becomes air,39.36,2,in stock
vagabonding an uncommon guide to the art of longterm world travel,36.94,2,in stock
the unlikely pilgrimage of harold fry harold fry 1,43.62,5,in stock
